text_column,tokenized_text
Comments,['comments']
These people are true fascists We need to dismantle this apartheid atrocity,"['people', 'true', 'fascists', 'need', 'dismantle', 'apartheid', 'atrocity']"
They are not soldiers they are EXTREMIST and EVILDOERS ,"['soldiers', 'extremist', 'evildoers']"
All dogs have their eyes on the 500 billion worth of gas and everyone is eager for their share,"['dogs', 'eyes', '500', 'billion', 'worth', 'gas', 'everyone', 'eager', 'share']"
Pray for palestine ,"['pray', 'palestine']"
Palestine must be freed,"['palestine', 'must', 'freed']"
Bullshit Completely fake,"['bullshit', 'completely', 'fake']"
Not Israeli soldiers not wearing standard or specialized issued IDF boots Guess you forgot that little detail while producing the video,"['israeli', 'soldiers', 'wearing', 'standard', 'specialized', 'issued', 'idf', 'boots', 'guess', 'forgot', 'little', 'detail', 'producing', 'video']"
Busted Pallywood Take number 47373  IDF soldiers with sport shoes and AliExpress vest ,"['busted', 'pallywood', 'take', 'number', '47373', 'idf', 'soldiers', 'sport', 'shoes', 'aliexpress', 'vest']"
Free Palestine,"['free', 'palestine']"
"A country that asserts its power is waging war against women children and common citizens the rules of war are being broken every day and the world is silent even as the world watches humanity is collapsing in the world STOP THE GENOCIDE
FreePalestine FreeGazaNow","['country', 'asserts', 'power', 'waging', 'war', 'women', 'children', 'common', 'citizens', 'rules', 'war', 'broken', 'every', 'day', 'world', 'silent', 'even', 'world', 'watches', 'humanity', 'collapsing', 'world', 'stop', 'genocide', 'freepalestine', 'freegazanow']"
Its important for Americans to pay attention to events like this one  not just in Israel and the West Bank but around the world Foreign policy and international affairs can have a big impact on American lives and our economy whether its through trade immigration national…,"['important', 'americans', 'pay', 'attention', 'events', 'like', 'one', 'israel', 'west', 'bank', 'around', 'world', 'foreign', 'policy', 'international', 'affairs', 'big', 'impact', 'american', 'lives', 'economy', 'whether', 'trade', 'immigration']"
IDF Soldiers laughing About Murdering the people of Gaza All the Detergent in the World cant make you Clean,"['idf', 'soldiers', 'laughing', 'murdering', 'people', 'gaza', 'detergent', 'world', 'cant', 'make', 'clean']"
It’s kinda like this video,"['kinda', 'like', 'video']"
 An eye for an eye makes both sides blind This will never end,"['eye', 'eye', 'makes', 'sides', 'blind', 'never', 'end']"
The Hindutva gang members in India using Diwali festival crackers video of Delhi to equate and celebrate like that of Israel bombing of Gaza twittercomSudarshanNewsT…,"['hindutva', 'gang', 'members', 'india', 'using', 'diwali', 'festival', 'crackers', 'video', 'delhi', 'equate', 'celebrate', 'like', 'israel', 'bombing', 'gaza']"
Don’t care,['care']
Liars,['liars']
"Hamas brutally beat Gaza civilians who were tired of getting food from humanitarian aid trucks  Hamas took the goods for itself  This is a strong attack on humanity kindness and charity which I strongly condemn

Via kannnews","['hamas', 'brutally', 'beat', 'gaza', 'civilians', 'tired', 'getting', 'food', 'humanitarian', 'aid', 'trucks', 'hamas', 'took', 'goods', 'strong', 'attack', 'humanity', 'kindness', 'charity', 'strongly', 'condemn', 'via', 'kannnews']"
I seriously don’t know how anyone can defend these people,"['seriously', 'know', 'anyone', 'defend', 'people']"
They dont even care that they are being filmed,"['dont', 'even', 'care', 'filmed']"
They just keep showing their true nature Just like a brother said I need to be more religious as there is no way I am spending eternity in Hell with Israelis May Allah unveil  awaken our hearts minds ears  eyes so we turn to Him Before Dajjals arrival,"['keep', 'showing', 'true', 'nature', 'like', 'brother', 'said', 'need', 'religious', 'way', 'spending', 'eternity', 'hell', 'israelis', 'may', 'allah', 'unveil', 'awaken', 'hearts', 'minds', 'ears', 'eyes', 'turn', 'dajjals', 'arrival']"
This is textbook terrorism,"['textbook', 'terrorism']"
His cries for his mom and dad it’s so horrible This whole country must be dismantled The beginning of the end they’re trying to make their final blow,"['cries', 'mom', 'dad', 'horrible', 'whole', 'country', 'must', 'dismantled', 'beginning', 'end', 'trying', 'make', 'final', 'blow']"
So twisted and sickening,"['twisted', 'sickening']"
Serious how are they not considered a terrorist state and organization at this point,"['serious', 'considered', 'terrorist', 'state', 'organization', 'point']"
Honestly looks a lot like US policing,"['honestly', 'looks', 'lot', 'like', 'us', 'policing']"
This is Nazi Germany written all over it,"['nazi', 'germany', 'written']"
choosen people by shaytan,"['choosen', 'people', 'shaytan']"
If we had iPhones  body cams in occupied Europe of the 1940s I wonder how similar these scenes would be when the Gestapo came for Anne Franks family is this what it looked like,"['iphones', 'body', 'cams', 'occupied', 'europe', '1940s', 'wonder', 'similar', 'scenes', 'would', 'gestapo', 'came', 'anne', 'franks', 'family', 'looked', 'like']"
War criminal isrheil,"['war', 'criminal', 'isrheil']"
Zionists,['zionists']
The real terorist,"['real', 'terorist']"
IsraelTerorrist,['israelterorrist']
Did occupiers give the children two bottle of water for propaganda,"['occupiers', 'give', 'children', 'two', 'bottle', 'water', 'propaganda']"
How are the israelis are the ‘chosen people’ again,"['israelis', 'chosen', 'people']"
I am glad I could never get used to this When I was younger I got desensitized with violence but people can attain humanity if they work for it We should never let go of our humanity and never forget,"['glad', 'could', 'never', 'get', 'used', 'younger', 'got', 'desensitized', 'violence', 'people', 'attain', 'humanity', 'work', 'never', 'let', 'go', 'humanity', 'never', 'forget']"
True evil on the loose,"['true', 'evil', 'loose']"
Why can’t the palestinians seeing the incident grab whatever can and rushed to the rescue of a fellow friendI am watching too much hollywood movie and expect can happen like in the movie  haha,"['palestinians', 'seeing', 'incident', 'grab', 'whatever', 'rushed', 'rescue', 'fellow', 'friendi', 'watching', 'much', 'hollywood', 'movie', 'expect', 'happen', 'like', 'movie', 'haha']"
Lol they didnt even bother faking a Hebrew accent  this is as real as your entire fake narrative,"['lol', 'didnt', 'even', 'bother', 'faking', 'hebrew', 'accent', 'real', 'entire', 'fake', 'narrative']"
"Hello any Human there
Savages 
I am glad I could never get used to this When I was younger I got desensitized with violence","['hello', 'human', 'savages', 'glad', 'could', 'never', 'get', 'used', 'younger', 'got', 'desensitized', 'violence']"
Savages,['savages']
Chosen people ,"['chosen', 'people']"
Butchers,['butchers']
From the river to the sea Palestine will be free ,"['river', 'sea', 'palestine', 'free']"
God is Sufficient for us and He is the Best Trustee the Best Helper the Best Master and the Best to rely upon Khaybar Khaybar O Jews the army of Muhammad will return Allah is the Greatest Allah is the Greatest Allah is the Greatest,"['god', 'sufficient', 'us', 'best', 'trustee', 'best', 'helper', 'best', 'master', 'best', 'rely', 'upon', 'khaybar', 'khaybar', 'jews', 'army', 'muhammad', 'return', 'allah', 'greatest', 'allah', 'greatest', 'allah', 'greatest']"
And people are still asking why Al Aqsa Flood happened,"['people', 'still', 'asking', 'al', 'aqsa', 'flood', 'happened']"
Oh my god,"['oh', 'god']"
Restore the State of Palestine,"['restore', 'state', 'palestine']"
Boycott Netflix,"['boycott', 'netflix']"
Former US marine’s proPalestine interview resurfaces online,"['former', 'us', 'marine', 'propalestine', 'interview', 'resurfaces', 'online']"
barbarians,['barbarians']
If none of you know this is how hamas was created,"['none', 'know', 'hamas', 'created']"
Is that soldier wearing sneakers,"['soldier', 'wearing', 'sneakers']"
IsraelTerrorism,['israelterrorism']
Another proof,"['another', 'proof']"
Once again we will repeat it never enough without their weapons they are nothing we saw it well in 1942,"['repeat', 'never', 'enough', 'without', 'weapons', 'nothing', 'saw', 'well', '1942']"
This is what happens to the Palestinians that are supposedly Free,"['happens', 'palestinians', 'supposedly', 'free']"
In front of his children ,"['front', 'children']"
The IDF is a terrorist organization That is all,"['idf', 'terrorist', 'organization']"
The fact that hours before they made palestinians pose with bottle waters and said were not scum which btw theyre the ones depriving them of every basic need At least wait some days or something,"['fact', 'hours', 'made', 'palestinians', 'pose', 'bottle', 'waters', 'said', 'scum', 'btw', 'theyre', 'ones', 'depriving', 'every', 'basic', 'need', 'least', 'wait', 'days', 'something']"
US standards of civilization,"['us', 'standards', 'civilization']"
This is why the Palestinians in the West Bank must be armed Instead of arming the people the socalled “Palestinian” Authority does israel’s work for them,"['palestinians', 'west', 'bank', 'must', 'armed', 'instead', 'arming', 'people', 'socalled', 'palestinian', 'authority', 'israel', 'work']"
I hate Israel the Nazi regime,"['hate', 'israel', 'nazi', 'regime']"
Terrorists have often had young children participate in using explosives and weapons  They are trained in Hamas summer camps to do just that  Its a sad reality,"['terrorists', 'often', 'young', 'children', 'participate', 'using', 'explosives', 'weapons', 'trained', 'hamas', 'summer', 'camps', 'sad', 'reality']"
"Hebron is not occupied its under PA
Israel has security responsibility to arrest people that threat to its country and cause a risk in engaging terror

I pity his daugther to have witness it because her father chose to be a criminal","['hebron', 'occupied', 'pa', 'israel', 'security', 'responsibility', 'arrest', 'people', 'threat', 'country', 'cause', 'risk', 'engaging', 'terror', 'pity', 'daugther', 'witness', 'father', 'chose', 'criminal']"
Well done on the space Truth Appreciate you,"['well', 'done', 'space', 'truth', 'appreciate']"
Thanks I appreciate you coming on,"['thanks', 'appreciate', 'coming']"
Great news,"['great', 'news']"
But hamas made me do it,"['hamas', 'made']"
Toddler among US hostages in Gaza – White House,"['toddler', 'among', 'us', 'hostages', 'gaza', 'white', 'house']"
The White House says that a threeyearold American whose parents were killed by Hamas is among the hostages in Gaza,"['white', 'house', 'says', 'threeyearold', 'american', 'whose', 'parents', 'killed', 'hamas', 'among', 'hostages', 'gaza']"
President Joe Biden raised  the issue of hostages including a toddler,"['president', 'joe', 'biden', 'raised', 'issue', 'hostages', 'including', 'toddler']"
i hope he wont get a heartattack or carswimmingaccident in the next time,"['hope', 'wont', 'get', 'heartattack', 'carswimmingaccident', 'next', 'time']"
Palestinians appreciate very much every effort that comes in support of their cause,"['palestinians', 'appreciate', 'much', 'every', 'effort', 'comes', 'support', 'cause']"
Why is not on our major news outlets,"['major', 'news', 'outlets']"
Good luck with that Israel is doing everything by the book,"['good', 'luck', 'israel', 'everything', 'book']"
"Zionists mocking proPalestine protesters Disgusting behaviour from disgusting people

palestine savepalestine savegaza palestina palestinian jerusalem children israel alquds bds islam alaqsa prayforpalestine gazastrip turkey savepalestina savealaqsa muslim…","['zionists', 'mocking', 'propalestine', 'protesters', 'disgusting', 'behaviour', 'disgusting', 'people', 'palestine', 'savepalestine', 'savegaza', 'palestina', 'palestinian', 'jerusalem', 'children', 'israel', 'alquds', 'bds', 'islam', 'alaqsa', 'prayforpalestine', 'gazastrip', 'turkey', 'savepalestina', 'savealaqsa']"
"Dua 

Mere we can do for Palestine is 
Make Dua
Make Dua for Palestine
It will make our brothers in Palestine victorious

God willing

PrayForPalestine","['dua', 'mere', 'palestine', 'make', 'dua', 'make', 'dua', 'palestine', 'make', 'brothers', 'palestine', 'victorious', 'god', 'willing', 'prayforpalestine']"
"In memory of more than 10000 martyrs of the Gaza Strip a magnificent demonstration was held at Oslo Railway Station by Norwegians FreePalaestine PrayForPalestine GazaUnderAttack GazaGenocide 
","['memory', '10000', 'martyrs', 'gaza', 'strip', 'magnificent', 'demonstration', 'held', 'oslo', 'railway', 'station', 'norwegians', 'freepalaestine', 'prayforpalestine', 'gazaunderattack', 'gazagenocide']"
"Their mosques are being heated under the bombs theyre still not missing any prayers

Our mosques are being cooled with fans and ACs and were still skipping all 5 prayers
JummahMubarak PrayForPalestine","['mosques', 'heated', 'bombs', 'theyre', 'still', 'missing', 'prayers', 'mosques', 'cooled', 'fans', 'acs', 'still', 'skipping', '5', 'prayers', 'jummahmubarak', 'prayforpalestine']"
"Yemen  Stand with Palestine  

WeStandWithPalestine
PrayForPalestine
IsraelisATerorristState","['yemen', 'stand', 'palestine', 'westandwithpalestine', 'prayforpalestine', 'israelisaterorriststate']"
"Assalamuwalaikum 
A father lost his four children his world has come to an end May Allah protect the people of Palestine Amen  

freepalestian 
PrayForPalestine","['assalamuwalaikum', 'father', 'lost', 'four', 'children', 'world', 'come', 'end', 'may', 'allah', 'protect', 'people', 'palestine', 'amen', 'freepalestian', 'prayforpalestine']"
"Hezbollahs antiship missiles a little remedy for those pesky foreign warships in the Mediterranean
PrayForPalestine PalestineWillBeFree Palestine ","['hezbollahs', 'antiship', 'missiles', 'little', 'remedy', 'pesky', 'foreign', 'warships', 'mediterranean', 'prayforpalestine', 'palestinewillbefree', 'palestine']"
"AllahHuAkbar
Without a doubt with courage and bravery a grenade was thrown into the barrel of the tank destroying it
FreePalaestine PrayForPalestine GazaUnderAttack GazaGenocide 
","['allahhuakbar', 'without', 'doubt', 'courage', 'bravery', 'grenade', 'thrown', 'barrel', 'tank', 'destroying', 'freepalaestine', 'prayforpalestine', 'gazaunderattack', 'gazagenocide']"
"May Allah safeguard the people of Palestine bless them with strength and resilience and bring an end to their sufferings
 PrayForPalestine DivineProtection
FreePalaestine 
FreePalestine 
WeStandWithPalestine 
WeStandWithGaza
FreePalestineFromIsrael","['may', 'allah', 'safeguard', 'people', 'palestine', 'bless', 'strength', 'resilience', 'bring', 'end', 'sufferings', 'prayforpalestine', 'divineprotection', 'freepalaestine', 'freepalestine', 'westandwithpalestine', 'westandwithgaza', 'freepalestinefromisrael']"
"Khalid bin al waleed Mosque was completely destroyed by Israeli shelling in khan Younis Gaza
gazaunderattack palastine 
prayforgaza prayforpalestine","['khalid', 'bin', 'al', 'waleed', 'mosque', 'completely', 'destroyed', 'israeli', 'shelling', 'khan', 'younis', 'gaza', 'gazaunderattack', 'palastine', 'prayforgaza', 'prayforpalestine']"
"Gaza under heavy attack now
51123

Palestine PalestinianLivesMatter prayforpalestine gaza Gazagenocide IsrealPalestineconflict PrayForPalestine IsraelTerrorists PalestineGenocide PalestineWar GazaHospital IsraelAttack GazaUnderAttack GazaUnderSiege…","['gaza', 'heavy', 'attack', '51123', 'palestine', 'palestinianlivesmatter', 'prayforpalestine', 'gaza', 'gazagenocide', 'isrealpalestineconflict', 'prayforpalestine', 'israelterrorists', 'palestinegenocide', 'palestinewar', 'gazahospital', 'israelattack', 'gazaunderattack']"
"More beautiful Zionist talk
Would you like these people to live in your country

palestine savepalestine savegaza palestina palestinian jerusalem children israel alquds bds islam alaqsa prayforpalestine gazastrip turkey savepalestina savealaqsa muslim…","['beautiful', 'zionist', 'talk', 'would', 'like', 'people', 'live', 'country', 'palestine', 'savepalestine', 'savegaza', 'palestina', 'palestinian', 'jerusalem', 'children', 'israel', 'alquds', 'bds', 'islam', 'alaqsa', 'prayforpalestine', 'gazastrip', 'turkey', 'savepalestina', 'savealaqsa']"
"Are you not entertained enough

Palestine PalestinianLivesMatter prayforpalestine gaza Gazagenocide IsrealPalestineconflict PrayForPalestine IsraelTerrorists PalestineGenocide PalestineWar GazaHospital IsraelAttack GazaUnderAttack GazaUnderSiege…","['entertained', 'enough', 'palestine', 'palestinianlivesmatter', 'prayforpalestine', 'gaza', 'gazagenocide', 'isrealpalestineconflict', 'prayforpalestine', 'israelterrorists', 'palestinegenocide', 'palestinewar', 'gazahospital', 'israelattack', 'gazaunderattack']"
Highlights from last nights debate We must condemn the terrorist group of HAMAS usa hamasterrorists hamaspalestine palestine nikkihaley gop gopdebate israel prayforpalestine prayforisrael,"['highlights', 'last', 'nights', 'debate', 'must', 'condemn', 'terrorist', 'group', 'hamas', 'usa', 'hamasterrorists', 'hamaspalestine', 'palestine', 'nikkihaley', 'gop', 'gopdebate', 'israel', 'prayforpalestine', 'prayforisrael']"
The Quick Story About Israel Actions FreePalaestine ISLAM  prayforpalestine gazastrip savepalestina uk unitedstates unitedkingdom northernireland london greatbritian england NYC WashingtonDC losangeles sanfrancisco chicago longislandcity Spain Madrid Berlin,"['quick', 'story', 'israel', 'actions', 'freepalaestine', 'islam', 'prayforpalestine', 'gazastrip', 'savepalestina', 'uk', 'unitedstates', 'unitedkingdom', 'northernireland', 'london', 'greatbritian', 'england', 'nyc', 'washingtondc', 'losangeles', 'sanfrancisco', 'chicago', 'longislandcity', 'spain', 'madrid', 'berlin']"
"Our Patience is nothing…
prayforpalestine
freepalestine","['patience', 'prayforpalestine', 'freepalestine']"
"AllahHuAkbar

This is spain

FreePalaestine PrayForPalestine GazaUnderAttack GazaGenocide 
IMshamstrz","['allahhuakbar', 'spain', 'freepalaestine', 'prayforpalestine', 'gazaunderattack', 'gazagenocide', 'imshamstrz']"
"We are minutes away from death’ Gaza’s alShifa Hospital under attack

FreePalestineFromIsrael PrayForPalestine","['minutes', 'away', 'death', 'gaza', 'alshifa', 'hospital', 'attack', 'freepalestinefromisrael', 'prayforpalestine']"
That was amazing and the real truth  you just nailed it man Our prayers are with Gaza and the Palestinian people StandWithGaza PrayForPalestine” USA usataxe,"['amazing', 'real', 'truth', 'nailed', 'man', 'prayers', 'gaza', 'palestinian', 'people', 'standwithgaza', 'prayforpalestine', 'usa', 'usataxe']"
"TLP Millions March Towards Islamabad Pro Palestine Protest In Pakistan Every Body Is So Angry On Israel Attack On Palestine

Palestine PalestinianLivesMatter prayforpalestine gaza Gazagenocide IsrealPalestineconflict PrayForPalestine IsraelTerrorists…","['tlp', 'millions', 'march', 'towards', 'islamabad', 'pro', 'palestine', 'protest', 'pakistan', 'every', 'body', 'angry', 'israel', 'attack', 'palestine', 'palestine', 'palestinianlivesmatter', 'prayforpalestine', 'gaza', 'gazagenocide', 'isrealpalestineconflict', 'prayforpalestine']"
"Let us join together in heartfelt prayers for the people of Palestine May Allah protect them grant them strength and bring an end to the injustice they face 
PrayForPalestine JummahMubarak PeaceForPalestine FreePalestine 
FreePalaestine 
FreePalestine…","['let', 'us', 'join', 'together', 'heartfelt', 'prayers', 'people', 'palestine', 'may', 'allah', 'protect', 'grant', 'strength', 'bring', 'end', 'injustice', 'face', 'prayforpalestine', 'jummahmubarak', 'peaceforpalestine', 'freepalestine', 'freepalaestine']"
"This little girl is called Julia She lost her parents in the bombing by Israel in Gaza

FreePalestine IsraelTerroristState PrayForPalestine 
   gazaholocust","['little', 'girl', 'called', 'julia', 'lost', 'parents', 'bombing', 'israel', 'gaza', 'freepalestine', 'israelterroriststate', 'prayforpalestine', 'gazaholocust']"
"Philippine human rights campaigner granted bail

FreePalestineFromIsrael PrayForPalestine","['philippine', 'human', 'rights', 'campaigner', 'granted', 'bail', 'freepalestinefromisrael', 'prayforpalestine']"
Day 1150 I thought it was a high number but it is 9150 less than the number murdered in Gaza Palestine since 7 October 100daysofwalking 200DaysOfWalking drogheda PrayForGaza PrayForPalestine 300daysofwalking CeasefireForGaza,"['day', '1150', 'thought', 'high', 'number', '9150', 'less', 'number', 'murdered', 'gaza', 'palestine', 'since', '7', 'october', '100daysofwalking', '200daysofwalking', 'drogheda', 'prayforgaza', 'prayforpalestine', '300daysofwalking', 'ceasefireforgaza']"
"We keep that winning feeling  
Let’s continue the good work

FreePalestineFromIsrael PrayForPalestine","['keep', 'winning', 'feeling', 'let', 'continue', 'good', 'work', 'freepalestinefromisrael', 'prayforpalestine']"
"Assalamuwalaikum   

freepalestian 
PrayForPalestine","['assalamuwalaikum', 'freepalestian', 'prayforpalestine']"
Powerful words and great resilience from the Gaza resident Abu Osama Daher after his wife and all his children became martyrs in the Zionist Israeli bombing in the northern Gaza Strip today,"['powerful', 'words', 'great', 'resilience', 'gaza', 'resident', 'abu', 'osama', 'daher', 'wife', 'children', 'became', 'martyrs', 'zionist', 'israeli', 'bombing', 'northern', 'gaza', 'strip', 'today']"
PrayForPalestine StopGenocidelnGaza,"['prayforpalestine', 'stopgenocidelngaza']"
Julia 3 years old lost her only family to an Israeli bombing  O God Allah Almighty Please help Palastinians Gazas people Ameen  StopGenocideOfPalestinians StopGenocideInGaza PrayForPalestine PrayForGaza,"['julia', '3', 'years', 'old', 'lost', 'family', 'israeli', 'bombing', 'god', 'allah', 'almighty', 'please', 'help', 'palastinians', 'gazas', 'people', 'ameen', 'stopgenocideofpalestinians', 'stopgenocideingaza', 'prayforpalestine', 'prayforgaza']"
"What is the Khalistan movement How is it linked to IndiaCanada tensions

FreePalestineFromIsrael PrayForPalestine PrayForGhaza PrayForPeace","['khalistan', 'movement', 'linked', 'indiacanada', 'tensions', 'freepalestinefromisrael', 'prayforpalestine', 'prayforghaza', 'prayforpeace']"
"Gaza has been asked to choose between ethnic cleansing and genocide…

palestine savepalestine savegaza palestina palestinian jerusalem children israel alquds bds islam alaqsa prayforpalestine gazastrip turkey savepalestina savealaqsa muslim humanrights…","['gaza', 'asked', 'choose', 'ethnic', 'cleansing', 'palestine', 'savepalestine', 'savegaza', 'palestina', 'palestinian', 'jerusalem', 'children', 'israel', 'alquds', 'bds', 'islam', 'alaqsa', 'prayforpalestine', 'gazastrip', 'turkey', 'savepalestina', 'savealaqsa', 'muslim']"
"Health assistance and medical devices for Palestine Alhamdulillah have been channeled on Thursday November 9 2023 This assistance was given to the Jabaliya Syuhada Health Center North Gaza in the form of 1 unit of health aids and 30 packages of medical needs
PrayForpalestine","['health', 'assistance', 'medical', 'devices', 'palestine', 'alhamdulillah', 'channeled', 'thursday', 'november', '9', '2023', 'assistance', 'given', 'jabaliya', 'syuhada', 'health', 'center', 'north', 'gaza', 'form', '1', 'unit', 'health', 'aids', '30', 'packages', 'medical', 'needs', 'prayforpalestine']"
"Many Palestinians continue to struggle for survival due to limited access to basic necessities


PrayforPalestine 
Palestine Gaza PrayForPalestine Pakistan Alkhidmat","['many', 'palestinians', 'continue', 'struggle', 'survival', 'due', 'limited', 'access', 'basic', 'necessities', 'prayforpalestine', 'palestine', 'gaza', 'prayforpalestine', 'pakistan', 'alkhidmat']"
"Dumbass Zionist propaganda and lies debunked again This time by 
AJEnglish
 

palestine savepalestine savegaza palestina palestinian jerusalem children israel alquds bds islam alaqsa prayforpalestine gazastrip turkey savepalestina savealaqsa muslim humanrights…","['dumbass', 'zionist', 'propaganda', 'lies', 'debunked', 'time', 'ajenglish', 'palestine', 'savepalestine', 'savegaza', 'palestina', 'palestinian', 'jerusalem', 'children', 'israel', 'alquds', 'bds', 'islam', 'alaqsa', 'prayforpalestine', 'gazastrip', 'turkey', 'savepalestina', 'savealaqsa', 'muslim']"
"Breaking

Palestine PalestinianLivesMatter prayforpalestine gaza Gazagenocide IsrealPalestineconflict PrayForPalestine IsraelTerrorists PalestineGenocide PalestineWar GazaHospital IsraelAttack GazaUnderAttack GazaUnderSiege CeasefireForGazaNOW","['breaking', 'palestine', 'palestinianlivesmatter', 'prayforpalestine', 'gaza', 'gazagenocide', 'isrealpalestineconflict', 'prayforpalestine', 'israelterrorists', 'palestinegenocide', 'palestinewar', 'gazahospital', 'israelattack', 'gazaunderattack', 'gazaundersiege', 'ceasefireforgazanow']"
Manipulation of media narratives in the IsraeliPalestinian conflict FreeGazaNow FreePalaestin PrayForPeace PrayForPalestine,"['manipulation', 'media', 'narratives', 'israelipalestinian', 'conflict', 'freegazanow', 'freepalaestin', 'prayforpeace', 'prayforpalestine']"
"AsslamuAllekum  may Allah be pleased with him
Abu Ubaidah reiterated the statement of Khalid bin Walid","['asslamuallekum', 'may', 'allah', 'pleased', 'abu', 'ubaidah', 'reiterated', 'statement', 'khalid', 'bin', 'walid']"
By God I have brought to you people who love death just as you love life InshaAllah  Allah will surely grant success one day,"['god', 'brought', 'people', 'love', 'death', 'love', 'life', 'inshaallah', 'allah', 'surely', 'grant', 'success', 'one', 'day']"
FreePalaestine PrayForPalestine  GazaGenocide,"['freepalaestine', 'prayforpalestine', 'gazagenocide']"
