text_column,tokenized_text
Israel has imposed a full blockade on Gaza for the last 17 years Hamas is fighting back It is called resistance,"['israel', 'imposed', 'full', 'blockade', 'gaza', 'last', '17', 'years', 'hamas', 'fighting', 'back', 'called', 'resistance']"
"Palestine historically  DOES NOT BELONG TO A FEW ARABS THAT TURNED UP IN RECENT HISTORY
West Bank is traditionally Judea and Israel
NOT ARABIC until invaded by Ottomans","['palestine', 'historically', 'belong', 'arabs', 'turned', 'recent', 'history', 'west', 'bank', 'traditionally', 'judea', 'israel', 'arabic', 'invaded', 'ottomans']"
There is a multifront war occurring because others have joined in from other sides how do you not know this Why do you think the US are off the coast its not because Israel might need assistance with Gaza,"['multifront', 'war', 'occurring', 'others', 'joined', 'sides', 'know', 'think', 'us', 'coast', 'israel', 'might', 'need', 'assistance', 'gaza']"
So where are the designated  separated HAMAS facilities Oh thats right in civilian areas,"['designated', 'separated', 'hamas', 'facilities', 'oh', 'thats', 'right', 'civilian', 'areas']"
"There are no Hamas in the Westbank
Go to Ramallah with e TA licensplate
You might get to know  some","['hamas', 'westbank', 'go', 'ramallah', 'e', 'ta', 'licensplate', 'might', 'get', 'know']"
"The left
Me hate big things 
Me hate successful people 
Civilization bad","['left', 'hate', 'big', 'things', 'hate', 'successful', 'people', 'civilization', 'bad']"
You shared a video posted by a Hamas media network and then demonstrated that you have no idea about the situation in the West Bank Hamas is very active in the West Bank They just dont run the administration,"['shared', 'video', 'posted', 'hamas', 'media', 'network', 'demonstrated', 'idea', 'situation', 'west', 'bank', 'hamas', 'active', 'west', 'bank', 'dont', 'run', 'administration']"
Palestine is not a country,"['palestine', 'country']"
Gaza will be annexed by the state of Israel if Hamas and Hezbollah are unable to successfully fight off the IDF ground forces This means the rest of the people will be exterminated if Israel wins Maybe some will be relocated although no other nations are open to that now,"['gaza', 'annexed', 'state', 'israel', 'hamas', 'hezbollah', 'unable', 'successfully', 'fight', 'idf', 'ground', 'forces', 'means', 'rest', 'people', 'exterminated', 'israel', 'wins', 'maybe', 'relocated', 'although', 'nations', 'open']"
Nope none at all…this is area of peace loving Hamas…,"['nope', 'none', 'area', 'peace', 'loving']"
The real terorist,"['real', 'terorist']"
Stopnetanyahu,['stopnetanyahu']
I think they know whats in there more than we do,"['think', 'know', 'whats']"
Hamas is everywhere in the world hiding behind civilians claiming to be good Muslims,"['hamas', 'everywhere', 'world', 'hiding', 'behind', 'civilians', 'claiming', 'good', 'muslims']"
Is it “Israel” or Zionists,"['israel', 'zionists']"
Why Hamas doesn’t like their own people For the sake of their own people they can surrender and release the hostages,"['hamas', 'like', 'people', 'sake', 'people', 'surrender', 'release', 'hostages']"
Ethnic cleansing but now on an industrial scale,"['ethnic', 'cleansing', 'industrial', 'scale']"
"Now I am getting notice to write this  truth about zionist LoL

","['getting', 'notice', 'write', 'truth', 'zionist', 'lol']"
Most land and buildings in West Bank are owned by Jews with arabs rentingbut many refuse to pay rentguess landowners are sick of arrogant arabs not paying rent,"['land', 'buildings', 'west', 'bank', 'owned', 'jews', 'arabs', 'rentingbut', 'many', 'refuse', 'pay', 'rentguess', 'landowners', 'sick', 'arrogant', 'arabs', 'paying', 'rent']"
Your Brilliant,['brilliant']
"Do you mean Palestinians the people the folk or Palestine the rocks

If the latter the rocks ultimately do not give a sh1t

If its the people well in the end houses can be rebuilt

Lives however are once only","['mean', 'palestinians', 'people', 'folk', 'palestine', 'rocks', 'latter', 'rocks', 'ultimately', 'give', 'sh1t', 'people', 'well', 'end', 'houses', 'rebuilt', 'lives', 'however']"
Several Israeli occupation military positions in southern Lebanon have come under coordinated missile targeting Al Mayadeens correspondent reported on Sunday Hezbollah launched antitank guided missiles ATGMs toward the Israeli military sites of Ruwaysat alAlam,"['several', 'israeli', 'occupation', 'military', 'positions', 'southern', 'lebanon', 'come', 'coordinated', 'missile', 'targeting', 'al', 'mayadeens', 'correspondent', 'reported', 'sunday', 'hezbollah', 'launched', 'antitank', 'guided', 'missiles', 'atgms', 'toward', 'israeli', 'military', 'sites', 'ruwaysat', 'alalam']"
There is no Hamas there and this info is given to this guy by Hamas Now you know,"['hamas', 'info', 'given', 'guy', 'hamas', 'know']"
Because it’s never a war on Gaza it’s a war on Palestine ,"['never', 'war', 'gaza', 'war', 'palestine']"
Genocide,['genocide']
Who started this war now,"['started', 'war']"
You are an excellent reporter Danny Keep up the great work,"['excellent', 'reporter', 'danny', 'keep', 'great', 'work']"
ISRAEL BREAKS INTERNATIONAL LAW,"['israel', 'breaks', 'international', 'law']"
Because its genocide not a war,"['genocide', 'war']"
video from Iran,"['video', 'iran']"
Maybe,['maybe']
There absolutely is Hamas in the West Bank,"['absolutely', 'hamas', 'west', 'bank']"
You all act like gaza was the perfect neighbor,"['act', 'like', 'gaza', 'perfect', 'neighbor']"
there is hamas there we se our lies,"['hamas', 'se', 'lies']"
BB just wants land that isn’t his to build his little dollhouse,"['bb', 'wants', 'land', 'build', 'little', 'dollhouse']"
İndeed,['i̇ndeed']
No one is there in this world who take action against Israel,"['one', 'world', 'take', 'action', 'israel']"
Exactly ,['exactly']
There is Hamas in west bank  Hezbollah on Lebanon border,"['hamas', 'west', 'bank', 'hezbollah', 'lebanon', 'border']"
Because hamas is Palestine,"['hamas', 'palestine']"
Because its all a part of a greater Israel plan Iran is next,"['part', 'greater', 'israel', 'plan', 'iran', 'next']"
Ummm you clearly don’t know anything about this region Of course there’s Hamas in the West Bank… just becsue they don’t run the administration there doesn’t mean they don’t exist there,"['ummm', 'clearly', 'know', 'anything', 'region', 'course', 'hamas', 'west', 'becsue', 'run', 'administration', 'mean', 'exist']"
Hamas has tunnels all over the place,"['hamas', 'tunnels', 'place']"
"Elevate your trading game with PrimeXBT

As a proud partner I recommend PrimeXBT for its leveraged trading advanced features and you can trade forexindices

Trade with me here 

With my promo code Ezekiel you can receive up to 7000 on your…","['elevate', 'trading', 'game', 'primexbt', 'proud', 'partner', 'recommend', 'primexbt', 'leveraged', 'trading', 'advanced', 'features', 'trade', 'forexindices', 'trade', 'promo', 'code', 'ezekiel', 'receive', '7000']"
Unfortunately there is plenty of Hamas in the West Bank,"['unfortunately', 'plenty', 'hamas', 'west', 'bank']"
Hamas is also in the West Bank  Reading is a good thing,"['hamas', 'also', 'west', 'bank', 'reading', 'good', 'thing']"
"Good 
Turn them into a parking lot","['good', 'turn', 'parking', 'lot']"
We both know that Hamas is indeed embedded in the West Bank,"['know', 'hamas', 'indeed', 'embedded', 'west', 'bank']"
And who says there is no Hamas The useless PLO or Hamas,"['says', 'hamas', 'useless', 'plo', 'hamas']"
Hamas also has presence in West Bank,"['hamas', 'also', 'presence', 'west', 'bank']"
Stick to what you know not propaganda,"['stick', 'know', 'propaganda']"
The child Doaa is the only survivor of her family and only her aunt remains,"['child', 'doaa', 'survivor', 'family', 'aunt', 'remains']"
Always remember,"['always', 'remember']"
I see my children in all of them I dont know how heartless a person can be,"['see', 'children', 'dont', 'know', 'heartless', 'person']"
Do you agree,['agree']
Do not allow them to hijack Judaism,"['allow', 'hijack', 'judaism']"
"Israel has been targeting and bombing populated areas and residential buildings 
WORST WAR CRIMES","['israel', 'targeting', 'bombing', 'populated', 'areas', 'residential', 'buildings', 'worst', 'war', 'crimes']"
Pakistan leader great would,"['pakistan', 'leader', 'great', 'would']"
"Did someone tell her
 “you are next “","['someone', 'tell', 'next']"
How much money do they have to buy fake supporters,"['much', 'money', 'buy', 'fake', 'supporters']"
I have one thing to tell you Oct 7th will never be forgotten,"['one', 'thing', 'tell', 'oct', '7th', 'never', 'forgotten']"
"“If we have to have a choice between being dead and pitied and being alive with a bad image we’d rather be alive and have the bad image”
— Golda Meir","['choice', 'dead', 'pitied', 'alive', 'bad', 'image', 'rather', 'alive', 'bad', 'image', 'golda', 'meir']"
"They truly have no one to blame but their ruthless selves

She serves an excellent point Why have civil discussion with genocide supporters There is absolutely no benefit to give them any of our time

Let them drown in their arrogance and sin","['truly', 'one', 'blame', 'ruthless', 'selves', 'serves', 'excellent', 'point', 'civil', 'discussion', 'genocide', 'supporters', 'absolutely', 'benefit', 'give', 'time', 'let', 'drown', 'arrogance', 'sin']"
I stand with isreal,"['stand', 'isreal']"
You mean the Israeli army arresting terrorists and stripping them down to ensure that they arent wearing suicide vests Oh no the absolute horror,"['mean', 'israeli', 'army', 'arresting', 'terrorists', 'stripping', 'ensure', 'arent', 'wearing', 'suicide', 'vests', 'oh', 'absolute', 'horror']"
Actually the world is losing interest as expected ,"['actually', 'world', 'losing', 'interest', 'expected']"
"No the people of the world stand with Israel
These pro Hamas demonstrations are only reminding the world populations how much we dont like Islamic practices","['people', 'world', 'stand', 'israel', 'pro', 'hamas', 'demonstrations', 'reminding', 'world', 'populations', 'much', 'dont', 'like', 'islamic', 'practices']"
Not really It’s a war and children’s dead bodies make great PR for Hamas Many stand with Israel because they wouldn’t do that to their people,"['really', 'war', 'children', 'dead', 'bodies', 'make', 'great', 'pr', 'hamas', 'many', 'stand', 'israel', 'people']"
I wont be lectured about Israels right to defend itself by someone with metal snot,"['wont', 'lectured', 'israels', 'right', 'defend', 'someone', 'metal', 'snot']"
"𝗟𝗘𝗧 𝗚𝗔𝗭𝗔 𝗟𝗜𝗩𝗘 𝗧𝗛𝗘 𝗪𝗛𝗢𝗟𝗘 𝗪𝗢𝗥𝗟𝗗 𝗜𝗦 𝗪𝗔𝗧𝗖𝗛𝗜𝗡𝗚

Hundreds of US Jewish activists peacefully occupied New Yorks Statue of Liberty to demand an end to Israels “genocidal bombardment” of civilians in Gaza","['𝗟𝗘𝗧', '𝗚𝗔𝗭𝗔', '𝗟𝗜𝗩𝗘', '𝗧𝗛𝗘', '𝗪𝗛𝗢𝗟𝗘', '𝗪𝗢𝗥𝗟𝗗', '𝗜𝗦', '𝗪𝗔𝗧𝗖𝗛𝗜𝗡𝗚', 'hundreds', 'us', 'jewish', 'activists', 'peacefully', 'occupied', 'new', 'yorks', 'statue', 'liberty', 'demand', 'end', 'israels', 'genocidal', 'bombardment', 'civilians', 'gaza']"
"There needs to be a flourishing cocreative relationship built between them somehow

What they are doing to each other isn’t going to achieve this","['needs', 'flourishing', 'cocreative', 'relationship', 'built', 'somehow', 'going', 'achieve']"
"Israeli settlers BURN CHILDREN
IsraelisATerorrist 
StrikeforGaza","['israeli', 'settlers', 'burn', 'children', 'israelisaterorrist', 'strikeforgaza']"
BREAKING Israeli ISIS soldiers blow up a UNRWA school in Beit Hanoun northern Gaza Strip and applaud to celebrate the devastation and victory over the stonesمنغزةهناالقاهرة طوفانالأقصى FreePalestine    الهجومالبرّي كتائبالقسام  حماس   أبوعبيدة   فلسطينتنتصر…,"['breaking', 'israeli', 'isis', 'soldiers', 'blow', 'unrwa', 'school', 'beit', 'hanoun', 'northern', 'gaza', 'strip', 'applaud', 'celebrate', 'devastation', 'victory', 'stonesمنغزةهناالقاهرة', 'طوفانالأقصى', 'freepalestine', 'كتائبالقسام', 'حماس', 'أبوعبيدة']"
Do not forget the oppressed children of Palestine It is the moral duty of every human being to raise voice for them,"['forget', 'oppressed', 'children', 'palestine', 'moral', 'duty', 'every', 'human', 'raise', 'voice']"
Always stand with Palestine ,"['always', 'stand', 'palestine']"
The disordered Biden accuses the resistance of sexual violenceThis fool forgot to harass children,"['disordered', 'biden', 'accuses', 'resistance', 'sexual', 'violencethis', 'fool', 'forgot', 'harass', 'children']"
"The Zionist World Government

Mexico’s  Claudia Sheinbaum set to win 2024 election  

  2023  Geert Wilders","['zionist', 'world', 'government', 'mexico', 'claudia', 'sheinbaum', 'set', 'win', '2024', 'election', '2023', 'geert', 'wilders']"
After 75 years the new generation has awakened ,"['75', 'years', 'new', 'generation', 'awakened']"
Palestine will be free,"['palestine', 'free']"
Isreal is losing hopes of winning too,"['isreal', 'losing', 'hopes', 'winning']"
"همـ ـجية الإحتـ ـلال الصـ ـهيوني في مهاجمة المسـعفين والمرضى
The barbarism of the Zi0nist occuption in attacking paramedics and patients ","['همـ', 'ـجية', 'الإحتـ', 'ـلال', 'الصـ', 'ـهيوني', 'في', 'مهاجمة', 'المسـعفين', 'والمرضى', 'barbarism', 'zi0nist', 'occuption', 'attacking', 'paramedics', 'patients']"
"Earn Passive Income By Sharing Your Unused Network Resources
","['earn', 'passive', 'income', 'sharing', 'unused', 'network', 'resources']"
Huge losses has been done of civilians in Palestine,"['huge', 'losses', 'done', 'civilians', 'palestine']"
Israel has permanently lost the debate,"['israel', 'permanently', 'lost', 'debate']"
The vast majority support Israel,"['vast', 'majority', 'support', 'israel']"
This is exactly how I felt a couple weeks back,"['exactly', 'felt', 'couple', 'weeks', 'back']"
O yes Clearly Israel is losing,"['yes', 'clearly', 'israel', 'losing']"
100 isrwal is the most hated country in the world And will always be from now forth,"['100', 'isrwal', 'hated', 'country', 'world', 'always', 'forth']"
So sad world should unite embrace peace and humanity,"['sad', 'world', 'unite', 'embrace', 'peace', 'humanity']"
God bless her,"['god', 'bless']"
"DID YOU KNOW THAT ZIONIST CREATED THE LGBTQ  TRANS AGENDA

You heard that right At this point we should already be expecting who the culprit is

None other than our favourite war crime villains Zionism","['know', 'zionist', 'created', 'lgbtq', 'trans', 'agenda', 'heard', 'right', 'point', 'already', 'expecting', 'culprit', 'none', 'favourite', 'war', 'crime', 'villains', 'zionism']"
Israel vs Palestine,"['israel', 'vs', 'palestine']"
I just cried over this same video she’s talking about I sat and prayed crying to La Virgencita  to make this stop To protect the children of Gaza and Congo who are suffering,"['cried', 'video', 'talking', 'sat', 'prayed', 'crying', 'la', 'virgencita', 'make', 'stop', 'protect', 'children', 'gaza', 'congo', 'suffering']"
Only support Palestine,"['support', 'palestine']"
Love Palestine,"['love', 'palestine']"
Well if they wouldnt be lying the whole time,"['well', 'wouldnt', 'lying', 'whole', 'time']"
She is down bad,['bad']
Hamas this saying,"['hamas', 'saying']"
We love Israel and support them ,"['love', 'israel', 'support']"
"

November Performance 

As the Fund Manager at INVasset PMS Im thrilled to share our stellar monthly returns of 1009 outshining the BSE TRI 500s 706 Our quantbased datadriven algorithmic strategy betting on the IndiaStory with a strategic…","['november', 'performance', 'fund', 'manager', 'invasset', 'pms', 'im', 'thrilled', 'share', 'stellar', 'monthly', 'returns', '1009', 'outshining', 'bse', 'tri', '500s', '706', 'quantbased', 'datadriven', 'algorithmic', 'strategy', 'betting', 'indiastory']"
America we are told are the role modern of all developing states in African There is no way I would have believed if I was told that this also happen in America just like my country,"['america', 'told', 'role', 'modern', 'developing', 'states', 'african', 'way', 'would', 'believed', 'told', 'also', 'happen', 'america', 'like', 'country']"
No it wont because its really easy Return the hostages and surrender Done If you somehow think the actions of Oct 7th were justified I cant help you either,"['wont', 'really', 'easy', 'return', 'hostages', 'surrender', 'done', 'somehow', 'think', 'actions', 'oct', '7th', 'justified', 'cant', 'help', 'either']"
weird my main takeaway has been that Palestinians overwhelmingly love violent jihad something like over 70 in both Gaza and the West Bank,"['weird', 'main', 'takeaway', 'palestinians', 'overwhelmingly', 'love', 'violent', 'jihad', 'something', 'like', '70', 'gaza', 'west', 'bank']"
Nose ring,"['nose', 'ring']"
Give me a damn break you are defending people who consciously and deliberately chose to sacrifice their lives and remain within active battle grounds could you care about their lives more than the little they cared about their own Probably not which means you don’t care at…,"['give', 'damn', 'break', 'defending', 'people', 'consciously', 'deliberately', 'chose', 'sacrifice', 'lives', 'remain', 'within', 'active', 'battle', 'grounds', 'could', 'care', 'lives', 'little', 'cared', 'probably', 'means', 'care']"
I’ll just set this here,['set']
"This is the power of social media 

Earlier days newspapers would bring us the insanely “balanced” perspective of GenocideJoe","['power', 'social', 'media', 'earlier', 'days', 'newspapers', 'would', 'bring', 'us', 'insanely', 'balanced', 'perspective', 'genocidejoe']"
"Youve lost me here

Zero logic to anything Youve just stated about Isreal","['youve', 'lost', 'zero', 'logic', 'anything', 'youve', 'stated', 'isreal']"
The heroic IDF fighter fights face to face against two terrorists He is wounded by a grenade but eliminates both of them ,"['heroic', 'idf', 'fighter', 'fights', 'face', 'face', 'two', 'terrorists', 'wounded', 'grenade', 'eliminates']"
Quando Hamas joga misseis esfaqueia israelenses e jogando pedras elas ficam em suas casas sem se preocuparem,"['quando', 'hamas', 'joga', 'misseis', 'esfaqueia', 'israelenses', 'e', 'jogando', 'pedras', 'elas', 'ficam', 'em', 'suas', 'casas', 'sem', 'se', 'preocuparem']"
Nose ring alert,"['nose', 'ring', 'alert']"
No body stands with terroists,"['body', 'stands', 'terroists']"
"One is too many

October 7th happened
It wont happen again

Dont start none wont be none","['one', 'many', 'october', '7th', 'happened', 'wont', 'happen', 'dont', 'start', 'none', 'wont', 'none']"
I cant take anyone serious with a bugger catcher in their nose,"['cant', 'take', 'anyone', 'serious', 'bugger', 'catcher', 'nose']"
Boycott and participate in stopping the bloodshed Boycott and participate in stopping the destruction of homes Boycott and participate in stopping the terrorist raids on the Gaza Strip Boycott and participate in stopping the killing of children women and youth Boycott and be…,"['boycott', 'participate', 'stopping', 'bloodshed', 'boycott', 'participate', 'stopping', 'destruction', 'homes', 'boycott', 'participate', 'stopping', 'terrorist', 'raids', 'gaza', 'strip', 'boycott', 'participate', 'stopping', 'killing', 'children', 'women', 'youth', 'boycott']"
Speak for yourself,['speak']
"I have embraced her view At one time I wanted a two person solution

Now I want Palestine Zionists disgust me with their blood thirsty violence","['embraced', 'view', 'one', 'time', 'wanted', 'two', 'person', 'solution', 'want', 'palestine', 'zionists', 'disgust', 'blood', 'thirsty', 'violence']"
"The majority of the PEOPLE stand with Israel They all saw what happened on October 7th 2023 
Hamas started the war Israel is going to finish it They have no other choice","['majority', 'people', 'stand', 'israel', 'saw', 'happened', 'october', '7th', '2023', 'hamas', 'started', 'war', 'israel', 'going', 'finish', 'choice']"
"that dummy is the sole reason why we have wars in this world Pathetic Terrorist would rape  kill her without thinking twice

Dummy","['dummy', 'sole', 'reason', 'wars', 'world', 'pathetic', 'terrorist', 'would', 'rape', 'kill', 'without', 'thinking', 'twice', 'dummy']"
Anyone that supports Hamas supports terrorism,"['anyone', 'supports', 'hamas', 'supports', 'terrorism']"
"Meet Kayla Goodwin from Whitewater Wisconsin

Kayla a Hamas cheerleader appears to monetize her content on OnlyFans 

Contact OnlyFans and demand Kayla Goodwin’s account is shut down 
supportonlyfanscom ","['meet', 'kayla', 'goodwin', 'whitewater', 'wisconsin', 'kayla', 'hamas', 'cheerleader', 'appears', 'monetize', 'content', 'onlyfans', 'contact', 'onlyfans', 'demand', 'kayla', 'goodwin', 'account', 'shut', 'supportonlyfanscom']"
"It wasnt just about October 7th

This is a recurring theme

against the PEOPLE of Palestine","['wasnt', 'october', '7th', 'recurring', 'theme', 'people', 'palestine']"
of All this,[]
Who’s this endgame drug addict,"['endgame', 'drug', 'addict']"
BS,['bs']
O Europeans and the Western world you are not our enemies We Arabs do not like enemies and we do not have enemies around the world but whoever comes and takes our land without right and destroys our dreams women men and youth this is only our enemy We love peace and our…,"['europeans', 'western', 'world', 'enemies', 'arabs', 'like', 'enemies', 'enemies', 'around', 'world', 'whoever', 'comes', 'takes', 'land', 'without', 'right', 'destroys', 'dreams', 'women', 'men', 'youth', 'enemy', 'love', 'peace']"
At this point I desperately need some mental care,"['point', 'desperately', 'need', 'mental', 'care']"
The world is with Israel,"['world', 'israel']"
How much crying did you do on Oct 8th,"['much', 'crying', 'oct', '8th']"
better to concern for hostages,"['better', 'concern', 'hostages']"
"Surely this is the world

Lets get this Video to 2 million views to try and help the three ladies from Kitoai to go to Thailand again next year 2024 Japan Expo Thailand 

ここちゃぴえんちゃん","['surely', 'world', 'lets', 'get', 'video', '2', 'million', 'views', 'try', 'help', 'three', 'ladies', 'kitoai', 'go', 'thailand', 'next', 'year', '2024', 'japan', 'expo', 'thailand', 'ここちゃぴえんちゃん']"
Who cares ,['cares']
People are so proud to fall for propaganda when yall should be embarrassed,"['people', 'proud', 'fall', 'propaganda', 'yall', 'embarrassed']"
"The only thing I see is more hate more against 
From both sides  But never a solution

We must stand up for all children in Israel and Palestine
How do we make sure Hamas stops attacking
How can we stop the hate teachings
How can we stop the extremists in both camps…","['thing', 'see', 'hate', 'sides', 'never', 'solution', 'must', 'stand', 'children', 'israel', 'palestine', 'make', 'sure', 'hamas', 'stops', 'attacking', 'stop', 'hate', 'teachings', 'stop', 'extremists']"
Many many people are starting to feel this No amount of propaganda or money at this point will fix this Israel is going down I hope Israeli people change their establishment fast,"['many', 'many', 'people', 'starting', 'feel', 'amount', 'propaganda', 'money', 'point', 'fix', 'israel', 'going', 'hope', 'israeli', 'people', 'change', 'establishment', 'fast']"
Palestine wheres that,"['palestine', 'wheres']"
Do you support Hamas Yes or no,"['support', 'hamas', 'yes']"
I support Israel my family and friends support Israel Hamas must be defeated,"['support', 'israel', 'family', 'friends', 'support', 'israel', 'hamas', 'must', 'defeated']"
Only by losers that don’t work for a living,"['losers', 'work', 'living']"
May Allah bless Yemen ,"['may', 'allah', 'bless', 'yemen']"
1300 Bigoil reps are plaguing COP28UAE  That’s 3 times their number at CO27 They are in Dubai to make and lots of it not to save  They live off Oil UAE’s future  their entire livelihoods depend on it being extracted and wrecking the earth,"['1300', 'bigoil', 'reps', 'plaguing', 'cop28uae', '3', 'times', 'number', 'co27', 'dubai', 'make', 'lots', 'save', 'live', 'oil', 'uae', 'future', 'entire', 'livelihoods', 'depend', 'extracted', 'wrecking', 'earth']"
I think all mothers feel the same ,"['think', 'mothers', 'feel']"
Thanks sis,"['thanks', 'sis']"
Mood,['mood']
Fu,['fu']
"That’s an oath of honor to help the oppressed people of Palestine 

May the Almighty grant you strength and guidance to fulfill your oath dear one","['oath', 'honor', 'help', 'oppressed', 'people', 'palestine', 'may', 'almighty', 'grant', 'strength', 'guidance', 'fulfill', 'oath', 'dear', 'one']"
What happened October 7,"['happened', 'october', '7']"
FreePalestineFromlsraelNOW,['freepalestinefromlsraelnow']
Hmmm,['hmmm']
 CeasefireNOW,['ceasefirenow']
Never forget 1007,"['never', 'forget', '1007']"
"עם ישראל חי  
StandWithIsrael HamasisISIS HamasTerrorists PalestinianTerrorists FreeTheHostages 
Now lets talk about no mediafreedom in Turkiye no democracy huge corruption cronyism nepotism and the oppression of the Kurds 
katilErdoğan","['עם', 'ישראל', 'חי', 'standwithisrael', 'hamasisisis', 'hamasterrorists', 'palestinianterrorists', 'freethehostages', 'lets', 'talk', 'mediafreedom', 'turkiye', 'democracy', 'huge', 'corruption', 'cronyism', 'nepotism', 'oppression', 'kurds', 'katilerdoğan']"
Couldn’t agree more,['agree']
Between dying and being pitied or living with a bad nameI chose bad name any time,"['dying', 'pitied', 'living', 'bad', 'namei', 'chose', 'bad', 'name', 'time']"
Stay strong beautiful people of Israel ,"['stay', 'strong', 'beautiful', 'people', 'israel']"
May Allah bless her heart,"['may', 'allah', 'bless', 'heart']"
Stay strong Palestine ,"['stay', 'strong', 'palestine']"
