text_column,tokenized_text
So return it to the ottomans,"['return', 'ottomans']"
The British took it from the Ottoman Empire in WW1 1918 They would never put it in Muslim hands to run because the Muslim Ottomans had just a few years before murdered a couple million Christians in the Armenian Assyrian genocide,"['british', 'took', 'ottoman', 'empire', 'ww1', '1918', 'would', 'never', 'put', 'muslim', 'hands', 'run', 'muslim', 'ottomans', 'years', 'murdered', 'couple', 'million', 'christians', 'armenian', 'assyrian', 'genocide']"
Please tell me what is your thesis on the right of Israel to exist when it was a Rothschild bankers project The Haavara Agreement  Hebrew הֶסְכֵּם הַעֲבָרָה transfer agreement was an agreement between Nazi Germany and Zionist German Jews signed on 25 August 1933,"['please', 'tell', 'thesis', 'right', 'israel', 'exist', 'rothschild', 'bankers', 'project', 'haavara', 'agreement', 'hebrew', 'transfer', 'agreement', 'agreement', 'nazi', 'germany', 'zionist', 'german', 'jews', 'signed', '25', 'august', '1933']"
It was just an area populated by farmers living peacefully on their land But because they were not a state and without the apparatus of state nor an army to defend themselves Jews felt entitled to infiltrate steal land and through terrorism establish their own state,"['area', 'populated', 'farmers', 'living', 'peacefully', 'land', 'state', 'without', 'apparatus', 'state', 'army', 'defend', 'jews', 'felt', 'entitled', 'infiltrate', 'steal', 'land', 'terrorism', 'establish', 'state']"
David and Jews ruled there before Palestine was even a NAME,"['david', 'jews', 'ruled', 'palestine', 'even', 'name']"
Palestine was the name of the land where Jews Muslims and Christians lived and they were all called Palestinians There was no Palestinian nation and most of todays Palestinian Arabs came from Jourdan,"['palestine', 'name', 'land', 'jews', 'muslims', 'christians', 'lived', 'called', 'palestinians', 'palestinian', 'nation', 'todays', 'palestinian', 'arabs', 'came', 'jourdan']"
As Golda Meir said she once was palestinian That was during the mandate,"['golda', 'meir', 'said', 'palestinian', 'mandate']"
The actual history that  Judaism supposed to be a riligion not a race bounded by a specific country,"['actual', 'history', 'judaism', 'supposed', 'riligion', 'race', 'bounded', 'specific', 'country']"
A forgotten part of the othman empire had a functioning community with cinema theaters  its own currency and a pier,"['forgotten', 'part', 'othman', 'empire', 'functioning', 'community', 'cinema', 'theaters', 'currency', 'pier']"
3000 years back jews used to live in Egypt under Pharaoh rule,"['3000', 'years', 'back', 'jews', 'used', 'live', 'egypt', 'pharaoh', 'rule']"
It reads Palestine though not British Mandate On maps monetary bills  coins  spare me the initials in Hebrew thing theyve no value marginalized in brackets postal stamps ID documents on the olive trees in the soil Theres naught forgotten about Palestine Aye,"['reads', 'palestine', 'though', 'british', 'mandate', 'maps', 'monetary', 'bills', 'coins', 'spare', 'initials', 'hebrew', 'thing', 'theyve', 'value', 'marginalized', 'brackets', 'postal', 'stamps', 'id', 'documents', 'olive', 'trees', 'soil', 'theres', 'naught', 'forgotten', 'palestine', 'aye']"
There is a map,['map']
"This is the top video during the war for more than 2 months

Surprisingly  From a zero distance the ghost of alQassam emerged

Tok Tok Assalamu alaikum ","['top', 'video', 'war', '2', 'months', 'surprisingly', 'zero', 'distance', 'ghost', 'alqassam', 'emerged', 'tok', 'tok', 'assalamu', 'alaikum']"
Like the fact it says it’s their land from an imaginary fictional book ,"['like', 'fact', 'says', 'land', 'imaginary', 'fictional', 'book']"
To the victor belong the spoilsregardless,"['victor', 'belong', 'spoilsregardless']"
Golda Meyr Dishagris,"['golda', 'meyr', 'dishagris']"
This is the real history,"['real', 'history']"
Bio says fighting for the truth lololol thats rich,"['bio', 'says', 'fighting', 'truth', 'lololol', 'thats', 'rich']"
Forgotten part of the Ottoman empire is not yet forgotten,"['forgotten', 'part', 'ottoman', 'empire', 'yet', 'forgotten']"
This Map of Palestinian exits in HELL that is where they are heading to it is in Bermuda Triangle FUGITIVES,"['map', 'palestinian', 'exits', 'hell', 'heading', 'bermuda', 'triangle', 'fugitives']"
Please only use the version of history that we  have constructed for you ,"['please', 'use', 'version', 'history', 'constructed']"
Read history read about whom Moses fought with They were Southern Egyptians and do you know what they called themselves Read about it,"['read', 'history', 'read', 'moses', 'fought', 'southern', 'egyptians', 'know', 'called', 'read']"
Ive never understood this insistence to prove  Who was here first as if thats the ultimate arbiter Yes I get the notion of birthright but surely who occupied land thousands of years ago cannot automatically trump  who should be on land now No other nation does this,"['ive', 'never', 'understood', 'insistence', 'prove', 'first', 'thats', 'ultimate', 'arbiter', 'yes', 'get', 'notion', 'birthright', 'surely', 'occupied', 'land', 'thousands', 'years', 'ago', 'automatically', 'trump', 'land', 'nation']"
Sensitive much,"['sensitive', 'much']"
people dont like the truth,"['people', 'dont', 'like', 'truth']"
Kate I better retire happy with children and grandchildrenInstead of pretentious and begono,"['kate', 'better', 'retire', 'happy', 'children', 'grandchildreninstead', 'pretentious', 'begono']"
Forgotten indeed yet it has its own system of government  currently shame on you Israel never existed in 1940,"['forgotten', 'indeed', 'yet', 'system', 'government', 'currently', 'shame', 'israel', 'never', 'existed', '1940']"
"Spread awareness  ensure that every dream takes flight
Take the pledge against HPV now ","['spread', 'awareness', 'ensure', 'every', 'dream', 'takes', 'flight', 'take', 'pledge', 'hpv']"
Palestine,['palestine']
You will cry and have a relief,"['cry', 'relief']"
Hypocrisy  Stupidity,"['hypocrisy', 'stupidity']"
Why dont you just ask the land in England just times you love the city of London for you to occupy ,"['dont', 'ask', 'land', 'england', 'times', 'love', 'city', 'london', 'occupy']"
The WORLD stands with Palestine ,"['world', 'stands', 'palestine']"
Don’t stop talking about Palestine,"['stop', 'talking', 'palestine']"
Heart touching ,"['heart', 'touching']"
Dont stop praying,"['dont', 'stop', 'praying']"
One mane army ,"['one', 'mane', 'army']"
Thats actually 24 passports and the posts authenticity is questionable,"['thats', 'actually', '24', 'passports', 'posts', 'authenticity', 'questionable']"
MY FAVOURITE THING TO FLUSH ,"['favourite', 'thing', 'flush']"
Did you agree,['agree']
"This is an Iranian passport 
We never recognized that fake country as legitimate
 and we dont even write its name","['iranian', 'passport', 'never', 'recognized', 'fake', 'country', 'legitimate', 'dont', 'even', 'write', 'name']"
Say Ameen,"['say', 'ameen']"
I am Pakistani  and stand With Palestin ,"['pakistani', 'stand', 'palestin']"
Palestinian rappers killing it,"['palestinian', 'rappers', 'killing']"
People who support ISRAEL are supporting CRIME ,"['people', 'support', 'israel', 'supporting', 'crime']"
The whole world stands with Palestine ,"['whole', 'world', 'stands', 'palestine']"
Putting things in perspectives,"['putting', 'things', 'perspectives']"
We Stand with Palestine ,"['stand', 'palestine']"
"Muslims invasions you mean

London ","['muslims', 'invasions', 'mean', 'london']"
Agree,['agree']
Israel a child killer state,"['israel', 'child', 'killer', 'state']"
I stand with Palestine from Pakistan,"['stand', 'palestine', 'pakistan']"
We stand with palistine,"['stand', 'palistine']"
"Shocking footage from Transcarpathia Ukraine

A deputy detonated three grenades in the building of Keretskovsky village council  26 people were injured 6 of them in serious condition

The deputy who detonated the grenades is now in intensive care","['shocking', 'footage', 'transcarpathia', 'ukraine', 'deputy', 'detonated', 'three', 'grenades', 'building', 'keretskovsky', 'village', 'council', '26', 'people', 'injured', '6', 'serious', 'condition', 'deputy', 'detonated', 'grenades', 'intensive', 'care']"
The moral Israeli occupation army attacks journalists,"['moral', 'israeli', 'occupation', 'army', 'attacks', 'journalists']"
Yes me too Palestine must be peaceful,"['yes', 'palestine', 'must', 'peaceful']"
"And the rulings of the Arabs are afraid of Israel
Damn when history records this","['rulings', 'arabs', 'afraid', 'israel', 'damn', 'history', 'records']"
Yes they stand with them but only on social media,"['yes', 'stand', 'social', 'media']"
"Keep in touch with friends and loved ones this Christmas season 

Register your Smart Bro Pocket WiFi and Rocket SIM devices to UNLIDATA 999 to enjoy unlimited data for all sites and apps valid for 30 days

Load now via the Smart Online Store ","['keep', 'touch', 'friends', 'loved', 'ones', 'christmas', 'season', 'register', 'smart', 'bro', 'pocket', 'wifi', 'rocket', 'sim', 'devices', 'unlidata', '999', 'enjoy', 'unlimited', 'data', 'sites', 'apps', 'valid', '30', 'days', 'load', 'via', 'smart', 'online', 'store']"
We stand with Palestine ,"['stand', 'palestine']"
Where is pakistani Passport,"['pakistani', 'passport']"
Sudanese passport stamp,"['sudanese', 'passport', 'stamp']"
We Stand with Palestine,"['stand', 'palestine']"
Sums it up perfect,"['sums', 'perfect']"
Yessir,['yessir']
Hopefully the peace  normal life for palestinian people Will Come soon ,"['hopefully', 'peace', 'normal', 'life', 'palestinian', 'people', 'come', 'soon']"
One Day,"['one', 'day']"
I am from Pakistan and I stand with Palestine ,"['pakistan', 'stand', 'palestine']"
"Dont stop talking about Palestine 
Dont stop talking about Palestine 
Dont stop talking about Palestine 
Dont stop talking about Palestine 
Dont stop talking about Palestine 
Dont stop talking about Palestine 
Dont stop talking about Palestine","['dont', 'stop', 'talking', 'palestine', 'dont', 'stop', 'talking', 'palestine', 'dont', 'stop', 'talking', 'palestine', 'dont', 'stop', 'talking', 'palestine', 'dont', 'stop', 'talking', 'palestine', 'dont', 'stop', 'talking', 'palestine', 'dont', 'stop', 'talking', 'palestine']"
I didnt know world leaders were so greedy and hypocritical,"['didnt', 'know', 'world', 'leaders', 'greedy', 'hypocritical']"
This Amazon shopping hack is like Prime Day on steroids,"['amazon', 'shopping', 'hack', 'like', 'prime', 'day', 'steroids']"
Imgane this pain,"['imgane', 'pain']"
Yes,['yes']
There is no such thing as Palestine,"['thing', 'palestine']"
Whole world stand with Humanity ,"['whole', 'world', 'stand', 'humanity']"
One man army ,"['one', 'man', 'army']"
Should stand,['stand']
Is this guy looking for another suspension,"['guy', 'looking', 'another', 'suspension']"
Notably not a single US passport ,"['notably', 'single', 'us', 'passport']"
Ofcourse,['ofcourse']
Pakistan Stand with Palestine ,"['pakistan', 'stand', 'palestine']"
That’s less than 20 of the entire world lmao,"['less', '20', 'entire', 'world', 'lmao']"
Not me…I stand with Israel,"['stand', 'israel']"
Nope,['nope']
Not even a little the people but not the hamas government,"['even', 'little', 'people', 'hamas', 'government']"
No they dont,['dont']
God is great,"['god', 'great']"
Yeah but they do it from a very safe distance,"['yeah', 'safe', 'distance']"
Truth and right are not based on universal mass appeal Right is right even if no one is doing it so is wrong Truth is truth even if no one recognizes it   So the world can stand with whoever it likes but Hamas is an aggressor  Im sorry for the innocent civilians caught up…,"['truth', 'right', 'based', 'universal', 'mass', 'appeal', 'right', 'right', 'even', 'one', 'wrong', 'truth', 'truth', 'even', 'one', 'recognizes', 'world', 'stand', 'whoever', 'likes', 'hamas', 'aggressor', 'im', 'sorry', 'innocent', 'civilians', 'caught']"
See the difference,"['see', 'difference']"
Lool not,['lool']
No we don’t,[]
"By the way I havent seen your post in a few days Youre one of my favorite antisemites 
There can be no love without hate","['way', 'havent', 'seen', 'post', 'days', 'youre', 'one', 'favorite', 'antisemites', 'love', 'without', 'hate']"
Because God is with them,['god']
Todays harvest in the Juhour AlAdeek area AlQassam fighters eliminated the whole group of ed soldiers And returned safely,"['todays', 'harvest', 'juhour', 'aladeek', 'area', 'alqassam', 'fighters', 'eliminated', 'whole', 'group', 'ed', 'soldiers', 'returned', 'safely']"
Free plastine,"['free', 'plastine']"
Reality,['reality']
More of the world stands with Israel and you know it,"['world', 'stands', 'israel', 'know']"
Difference ,['difference']
The world,['world']
Bollox,['bollox']
They dont care  about Palestinians They support a perverted notion of justice leaving  good and evil aside for them justice is those who  are in need must be sacrificed to Since Palestinians clearly need Israel to sacrifice that Israel doesnt is as unjust as it gets,"['dont', 'care', 'palestinians', 'support', 'perverted', 'notion', 'justice', 'leaving', 'good', 'evil', 'aside', 'justice', 'need', 'must', 'sacrificed', 'since', 'palestinians', 'clearly', 'need', 'israel', 'sacrifice', 'israel', 'doesnt', 'unjust', 'gets']"
So many misguided and deceived souls  very sad ,"['many', 'misguided', 'deceived', 'souls', 'sad']"
Wow this is a real worldwide Muslim immigration problem we have here ,"['wow', 'real', 'worldwide', 'muslim', 'immigration', 'problem']"
"Nope not me 

Your post has now been debunked Community notes not needed","['nope', 'post', 'debunked', 'community', 'notes', 'needed']"
"The Iraq Britain Council is Establishing an Agritech Committee under the chairmanship of Dr Amet Selman CEO of AAA Holding Group

","['iraq', 'britain', 'council', 'establishing', 'agritech', 'committee', 'chairmanship', 'dr', 'amet', 'selman', 'ceo', 'aaa', 'holding', 'group']"
Sad part is no countries want to refugee them,"['sad', 'part', 'countries', 'want', 'refugee']"
I stand with Narnia and Neverland,"['stand', 'narnia', 'neverland']"
Here in America it’s about 12,"['america', '12']"
I stand with Gaza,"['stand', 'gaza']"
"Isaiah 52024
Woe to those who call evil good and good evil
 Who put darkness for light and light for darkness
 Who put bitter for sweet and sweet for bitter
21 Woe to those who are wise in their own eyes
 And prudent in their own sight
22 Woe to men mighty at drinking…","['isaiah', '52024', 'woe', 'call', 'evil', 'good', 'good', 'evil', 'put', 'darkness', 'light', 'light', 'darkness', 'put', 'bitter', 'sweet', 'sweet', 'bitter', '21', 'woe', 'wise', 'eyes', 'prudent', 'sight', '22', 'woe', 'men', 'mighty']"
Its time this war ends Both side to return people to there homes and countries Take injured kids to the hospital Release all kids and teens in prisonIsrael Have peace talks,"['time', 'war', 'ends', 'side', 'return', 'people', 'homes', 'countries', 'take', 'injured', 'kids', 'hospital', 'release', 'kids', 'teens', 'prisonisrael', 'peace', 'talks']"
Palestine free,"['palestine', 'free']"
No only terrorist supporter,"['terrorist', 'supporter']"
Yes to free  Palestinians from hamas,"['yes', 'free', 'palestinians', 'hamas']"
I see you all have your passports Better get in there and help them out They are gonna need it,"['see', 'passports', 'better', 'get', 'help', 'gon', 'na', 'need']"
Uh no,['uh']
India  USA and EU stand with ,"['india', 'usa', 'eu', 'stand']"
request you all to stop the killing of innocent children for the sake of God children are innocent whether they are Jews or Muslims dont forget humanity in the war,"['request', 'stop', 'killing', 'innocent', 'children', 'sake', 'god', 'children', 'innocent', 'whether', 'jews', 'muslims', 'dont', 'forget', 'humanity', 'war']"
And no subscriber stands with you 2 subshaha,"['subscriber', 'stands', '2', 'subshaha']"
The whole world has been fucked up for a while,"['whole', 'world', 'fucked']"
Not enough evidence sorry,"['enough', 'evidence', 'sorry']"
An elderly eyewitness reported that the Nazis arrested him and interrogated him When the Israelis said “I don’t know anything” they cut off his leg and he lay on the ground at one of the military crossings Here he testifies Who will punish this innocent grandfather…,"['elderly', 'eyewitness', 'reported', 'nazis', 'arrested', 'interrogated', 'israelis', 'said', 'know', 'anything', 'cut', 'leg', 'lay', 'ground', 'one', 'military', 'crossings', 'testifies', 'punish', 'innocent']"
"Hamas reported destruction of 72 tanks in 72 hours
 So 1 tankhr ","['hamas', 'reported', 'destruction', '72', 'tanks', '72', 'hours', '1', 'tankhr']"
"Important notice
This young man whom the Israeli occupation forces claimed to be armed named Nasr Imad alMadhoun a fourthyear medical student at the Islamic University in Gaza and this photo in front of the gate of Kamal Adwan hospital where he worked as an intern due…","['important', 'notice', 'young', 'man', 'israeli', 'occupation', 'forces', 'claimed', 'armed', 'named', 'nasr', 'imad', 'almadhoun', 'fourthyear', 'medical', 'student', 'islamic', 'university', 'gaza', 'photo', 'front', 'gate', 'kamal', 'adwan', 'hospital', 'worked', 'intern']"
No they don’t,[]
Nakba to Negev The Unheard Voices of a Land Divided,"['nakba', 'negev', 'unheard', 'voices', 'land', 'divided']"
Liar,['liar']
Looks like 24 people do,"['looks', 'like', '24', 'people']"
Stop violence and war in Palestine  let them live freely and peacefully,"['stop', 'violence', 'war', 'palestine', 'let', 'live', 'freely', 'peacefully']"
Kosovo Bosnia Really why in hell It was the Jews and Christians their αςς and stopped Serbia NONE of the Muslims countries ever cared about them,"['kosovo', 'bosnia', 'really', 'hell', 'jews', 'christians', 'αςς', 'stopped', 'serbia', 'none', 'muslims', 'countries', 'ever', 'cared']"
Good they can take them,"['good', 'take']"
I havent made a passport yet but,"['havent', 'made', 'passport', 'yet']"
Their terrorism expose to the world,"['terrorism', 'expose', 'world']"
"Song On A List  Pharroh AK47

THE THRONE IS NOW AVAILABLE ON ALL MUSIC STREAMING PLATFORMS

Songs from The Throne were distributed as Singles for technical reasons Type in the song name or Pharroh AK47 to find them

Tags","['song', 'list', 'pharroh', 'ak47', 'throne', 'available', 'music', 'streaming', 'platforms', 'songs', 'throne', 'distributed', 'singles', 'technical', 'reasons', 'type', 'song', 'name', 'pharroh', 'ak47', 'find', 'tags']"
Hamas,['hamas']
10,['10']
The blood of Palestinian,"['blood', 'palestinian']"
And the whole world could be wrong,"['whole', 'world', 'could', 'wrong']"
"You know there are very simple rules that prove that Zionists lie without Hamas and Palestinians or their enemy having any involvement in revealing it
First of all the absurdity and the trivia of the lie and let me tell you that its deliberate that they think they should…","['know', 'simple', 'rules', 'prove', 'zionists', 'lie', 'without', 'hamas', 'palestinians', 'enemy', 'involvement', 'revealing', 'first', 'absurdity', 'trivia', 'lie', 'let', 'tell', 'deliberate', 'think']"
Not,[]
"While they forgot the 15 million Afghans being expelled by Pakistan and the new rounds of fighting in South Sudan 

Funny how when things don’t fit the Socialist narrative they just get memory holed","['forgot', '15', 'million', 'afghans', 'expelled', 'pakistan', 'new', 'rounds', 'fighting', 'south', 'sudan', 'funny', 'things', 'fit', 'socialist', 'narrative', 'get', 'memory', 'holed']"
Baghdad,['baghdad']
Netanyahu is Hitler without a mustache,"['netanyahu', 'hitler', 'without', 'mustache']"
kids killers union never forget,"['kids', 'killers', 'union', 'never', 'forget']"
The world is going to see how WRONG they are,"['world', 'going', 'see', 'wrong']"
The Muslim world is good at crying for Palestine but not good at taking in Palestinians Why is that Saudi Arabia Egypt,"['muslim', 'world', 'good', 'crying', 'palestine', 'good', 'taking', 'palestinians', 'saudi', 'arabia', 'egypt']"
No it doesn’t,[]
"Arrest these criminals NOW Their goal is to make Gaza unliveable and then exile all Palestinians to Sinai

Dont fall for grandpas double speak","['arrest', 'criminals', 'goal', 'make', 'gaza', 'unliveable', 'exile', 'palestinians', 'sinai', 'dont', 'fall', 'grandpas', 'double', 'speak']"
I dont have passport or visa to do this   but I have id card,"['dont', 'passport', 'visa', 'id', 'card']"
We all Pakistanis stand with Palestine and Palestinians,"['pakistanis', 'stand', 'palestine', 'palestinians']"
Yes we do stand with Palestine,"['yes', 'stand', 'palestine']"
From Paris,['paris']
And the meanwhile,['meanwhile']
"I remember the story of George Floyd when all the world stood with him but USA gouvernement said 

The officer has the right to apply the law","['remember', 'story', 'george', 'floyd', 'world', 'stood', 'usa', 'gouvernement', 'said', 'officer', 'right', 'apply', 'law']"
From the river to the sea  ,"['river', 'sea']"
"We stand with Palestine  
We stand with humanity","['stand', 'palestine', 'stand', 'humanity']"
I stand with Palestine ,"['stand', 'palestine']"
LOL,['lol']
Free palestine,"['free', 'palestine']"
"Forget the fancy words UAE is hosting COP28 in order to derail it  “these countries theyre single source economies So theyre looking long term on how to keep themselves going and how they are keeping themselves going is keeping the oil industry” colWes Martin 
Bloomberg","['forget', 'fancy', 'words', 'uae', 'hosting', 'cop28', 'order', 'derail', 'countries', 'theyre', 'single', 'source', 'economies', 'theyre', 'looking', 'long', 'term', 'keep', 'going', 'keeping', 'going', 'keeping', 'oil', 'industry', 'colwes', 'martin', 'bloomberg']"
Afghanistan 15Dec2023 430pm,"['afghanistan', '15dec2023', '430pm']"
Strike,['strike']
I am not seeing a Pakistani Passport ,"['seeing', 'pakistani', 'passport']"
Palestine was always a land with a people,"['palestine', 'always', 'land', 'people']"
If you ever feel stupid remember there are people out there who think Israel is the victim,"['ever', 'feel', 'stupid', 'remember', 'people', 'think', 'israel', 'victim']"
"1 There was no country called Palestine before 1948 
2 The land that became the League of Nationssponsored British Mandate for Palestine was indeed an undeveloped backwater under its previous rulers the Ottomans
3 Israel did not invade Palestine in 1948 The UN enacted…","['1', 'country', 'called', 'palestine', '1948', '2', 'land', 'became', 'league', 'nationssponsored', 'british', 'mandate', 'palestine', 'indeed', 'undeveloped', 'backwater', 'previous', 'rulers', 'ottomans', '3', 'israel', 'invade', 'palestine', '1948', 'un']"
This is princess Mary Shlomzion Hamalka avenue in Jerusalem in 1940 and it was and still mostly Jewish Why are you trying to distort history,"['princess', 'mary', 'shlomzion', 'hamalka', 'avenue', 'jerusalem', '1940', 'still', 'mostly', 'jewish', 'trying', 'distort', 'history']"
Stop appropriating Jewish heritage,"['stop', 'appropriating', 'jewish', 'heritage']"
Until the British thought that they would do what they do best mess up countries,"['british', 'thought', 'would', 'best', 'mess', 'countries']"
If you had any idea you would know that during this period the Arabs wore traditional clothing and the Jews were divided into traditional and modern clothing What you see in the picture is a modern Jewish street,"['idea', 'would', 'know', 'period', 'arabs', 'wore', 'traditional', 'clothing', 'jews', 'divided', 'traditional', 'modern', 'clothing', 'see', 'picture', 'modern', 'jewish', 'street']"
"This photo taken in 1940 in Shlomzion Hamalka in Jerusalem depicts almost entirely a Jewish neighborhood showcasing Jewish culture and heritage

Regarding the country you are discussing Who was the Palestinian presidentprime minister What was its currency When was it…","['photo', 'taken', '1940', 'shlomzion', 'hamalka', 'jerusalem', 'depicts', 'almost', 'entirely', 'jewish', 'neighborhood', 'showcasing', 'jewish', 'culture', 'heritage', 'regarding', 'country', 'discussing', 'palestinian', 'presidentprime', 'minister', 'currency']"
You are showing a photo of a Jewish neighborhood in Jerusalem built by Jews on land owned by Jews from the 1880s Here is the same location today still full of Jews,"['showing', 'photo', 'jewish', 'neighborhood', 'jerusalem', 'built', 'jews', 'land', 'owned', 'jews', '1880s', 'location', 'today', 'still', 'full', 'jews']"
How does posting a picture of a Jewish neighborhood prove your point ,"['posting', 'picture', 'jewish', 'neighborhood', 'prove', 'point']"
FACT CHECK   this was  Jewish area of Jerusalem where  Muslims or Mohamedeans as the British called them were always a minority,"['fact', 'check', 'jewish', 'area', 'jerusalem', 'muslims', 'mohamedeans', 'british', 'called', 'always', 'minority']"
This is Princess Mary Street   Princess Royal and Countess of Harewood I dont remember that she was Palestinian,"['princess', 'mary', 'street', 'princess', 'royal', 'countess', 'harewood', 'dont', 'remember', 'palestinian']"
"1  Palestine was not invaded
2 Palestine has never been a country
3 Palestine was a region of the Ottoman Empire
4 When the empire was divided into separate lands eg Lebanon Syria Iraq Kuwait Palestine was divided  78 for the Arabs Jordan 22 for the Jews Israel","['1', 'palestine', 'invaded', '2', 'palestine', 'never', 'country', '3', 'palestine', 'region', 'ottoman', 'empire', '4', 'empire', 'divided', 'separate', 'lands', 'eg', 'lebanon', 'syria', 'iraq', 'kuwait', 'palestine', 'divided', '78', 'arabs', 'jordan', '22', 'jews', 'israel']"
"Complete failure COP28 draft agreement drops phaseout of fossil fuels 
FT
 COP28 OILCOP28","['complete', 'failure', 'cop28', 'draft', 'agreement', 'drops', 'phaseout', 'fossil', 'fuels', 'ft', 'cop28', 'oilcop28']"
