Comments,Unnamed: 1,neg,neu,pos
"Holashtak, the 8 day period of  austerity is starting from 17th March till 24th March 2024. Do's and Dont's
& the spiritual practise for this period.  
Clean it all,Oct 7"," 2023""",0.217488363,0.710553348,0.071958281
Indiscriminate killings.,"Oct 8, 2023",0.801795244,0.188151494,0.010053236
Seems not enough at this moment.,"Oct 7, 2023",0.849830151,0.139441565,0.010728289
Good,"Oct 7, 2023",0.060793348,0.329427868,0.609778821
They'll pay,"Oct 7, 2023",0.145201668,0.717851937,0.136946455
I am not Israeli but I want to thank Israel and its brave people for standing as first line of defence for the world against Islamic terrorism.,"Oct 7, 2023",0.034254022,0.263835192,0.701910853
To any Indian reading this am currently eating Cow ,"Oct 7, 2023",0.317185611,0.65378058,0.029033784
Omg,"Oct 8, 2023",0.185456634,0.485757768,0.328785598
They can’t hear you. Speak louder!,"Oct 8, 2023",0.488266557,0.428008884,0.083724499
Speak it loud and often.,"Oct 8, 2023",0.057225499,0.727989972,0.214784563
Goodness,"Oct 8, 2023",0.018457979,0.273033381,0.70850867
"You guys are having mercy on this guys,level down that entire state.","Oct 8, 2023",0.545621157,0.372646809,0.081732027
It’s not enough.,"Oct 8, 2023",0.812942624,0.170910507,0.016146785
"Hananya, brother, don't let this go in vain.... you should make this place as the name suggests a strip ... clean flat strip ..... Sorry can't sleep watching these horrific Videos coming from your brave country .... God bless","Oct 8, 2023",0.469288141,0.391231298,0.139480636
This his your army hahahahahahahaha,"Oct 8, 2023",0.139223084,0.599802434,0.260974467
"Israel needs to do lots more of this, its the only language hamas rapists understand.","Oct 8, 2023",0.524557352,0.434010416,0.041432187
Mossad is the hand of God !,"Oct 8, 2023",0.073137946,0.604221523,0.322640568
Level them!,"Oct 7, 2023",0.195868909,0.575122118,0.229008958
Iranian attack Rogue Regime Attak,"Oct 7, 2023",0.690900147,0.302645415,0.006454404
At the ice on mys minD...!,"Oct 7, 2023",0.093862951,0.785755515,0.120381542
Finished one’s and for all,"Oct 7, 2023",0.041216161,0.820068538,0.138715401
Pls they should make it louder!!!,"Oct 7, 2023",0.075922318,0.501142442,0.422935307
As should be so there is no language problems in communication.  We'll done #Israel,"Oct 7, 2023",0.117041007,0.581844807,0.301114112
Superb ,"Oct 7, 2023",0.015337465,0.170337275,0.814325273
I stand with Israel,"Oct 7, 2023",0.079129256,0.664369583,0.256501168
They need to level the place,"Oct 7, 2023",0.34439683,0.610915542,0.04468767
Don’t listen to any country or UN on ceasefire,"Oct 7, 2023",0.760738015,0.230376542,0.008885433
Action speaks louder than voice,"Oct 8, 2023",0.097919345,0.721529543,0.180551082
Jai bajarangabalee...,"Oct 7, 2023",0.104214557,0.8168571,0.078928329
"This is just one concrete structure,nothing to be happy about,is this what the Hamas deserves???","Oct 7, 2023",0.91482383,0.080074407,0.005101671
Well done. Good job Israel. ,"Oct 7, 2023",0.021267505,0.102750689,0.875981748
,"Oct 8, 2023",0,0,0
They left a bunch of buildings standing….dont hold back Isreal….tear it all down,"Oct 7, 2023",0.632524788,0.330347538,0.037127659
This map clearly shows you dont belong there.,"Dec 17, 2023",0.919554055,0.077001303,0.003444719
"Israel should have been settled in Uganda or in some wasteland in Europe. 
If Israel had been established in Europe, it would have been wiped out by Europeans. 
There was no state of Israel in history. Even Jews never wanted a country.","Dec 17, 2023",0.775906384,0.207395375,0.016698245
 Are you for real dude! it's like if Hindu people make a religious claim to California saying god promised it to them. Should the US then distribute California's population to the rest of the states? The solution is to live side by side in one democratic country for all.,"Dec 17, 2023",0.399853706,0.547075033,0.053071264
"History lesson:
Palestinian refugees are called that because they were moved from their lands to other areas normally.
The term refugee is not only given to people who come from outside that country but can also be refugees from the same country.
According to the 1948…","Dec 17, 2023",0.274633974,0.673559785,0.051806208
"History lesson:
What do you know about Nakba?","Dec 17, 2023",0.085711196,0.890042961,0.024245713
"If I come steal a small portion of what you have, is it theft or not?","Dec 17, 2023",0.347295791,0.63267231,0.020031922
Islam: the Religion of Conquest,"Dec 17, 2023",0.594356358,0.3938241,0.011819564
Why would they take them as refugees when they has their own land Palestine,"Dec 16, 2023",0.493727803,0.489540368,0.016731896
Take refugees so you can have all the land to yourself,"Dec 17, 2023",0.290794045,0.634796202,0.074409731
"Sorry Oli ….Arab countries …. Land in
The Arab world
You almost had it there didn’t you?
Almost","Dec 17, 2023",0.734125257,0.24110806,0.0247667
"it's not about Arabs, is it. it's about the direct descendents of the israelites keeping their land and the right for them to do so.","Dec 17, 2023",0.297051519,0.677929461,0.025019018
What's happening?,"Dec 16, 2023",0.229550824,0.733700097,0.036749065
Oil money,"Dec 16, 2023",0.229053497,0.6790272,0.091919303
You said it..The arab world,"Dec 17, 2023",0.387102246,0.555037081,0.057860658
"Zech 12
Jerusalem’s Enemies to Be Destroyed
12 A prophecy: The word of the Lord concerning Israel.
The Lord, who stretches out the heavens, who lays the foundation of the earth, and who forms the human spirit within a person, declares: 2 ","Dec 17, 2023",0.143289715,0.818913162,0.037797067
"If you care about the Israeli zionists,
Take them to the ""civilized"" world of USA and Europe. 
Why do you keep them in this danger and in the middle of ""barbaric arabs""? Give them Florida and protect them there if you care that much about them","Dec 17, 2023",0.846942127,0.143677354,0.009380527
Those living in the yellow area say to those living in the barely visible blue area: You are an invader. That's all there is to comedy.,"Dec 17, 2023",0.615226328,0.353853106,0.030920524
"Israel Admits To Killing Own Festival Goers https://youtu.be/DVNqPNN-UGY?si=WvSElC400-ilZisc… via 
@YouTube","Dec 17, 2023",0.712331355,0.27146861,0.016200012
"They don’t want help Israel steeling their land 
Free Palestine","Dec 17, 2023",0.717013896,0.265888989,0.017097045
"They are not owners' shares in a company for you to distribute according to your whim, and you have no right. You are asking for the owners of the land to be evacuated to become refugees. Palestine will remain a homeland for the Palestinians, whether you like it or not.","Dec 17, 2023",0.716562092,0.270534754,0.012903173
I would never go to any Arab country  not even to experience their country.  Nothing interesting there ,"Dec 17, 2023",0.951302588,0.044360243,0.004337147
Does it seem “yours” on this map ,"Dec 17, 2023",0.176233187,0.761452913,0.062313855
"Zionists own all of the west. They can go back there, as they all have citizenship. 
Unfortunately, Palestinians have close borders and have nowhere to go.","Dec 17, 2023",0.822541595,0.167454436,0.010004017
So right,"Dec 16, 2023",0.045637447,0.355992913,0.598369598
gay,"Dec 16, 2023",0.578644753,0.358497471,0.062857822
"This is our land, and we will leave Israel from our lands, God willing","Dec 16, 2023",0.193012312,0.705317378,0.10167031
"your post from yesterday invited to fight, crazy, right?
my emotions will be with nie people.If you post, don't think that when the division of brains he doesn't like ... you wonder you are our target - us ...","Dec 16, 2023",0.647716522,0.319550455,0.03273299
Back to your country easy,"Dec 17, 2023",0.148377627,0.611926258,0.239696071
We will give u some desert in Algeria. Go there make it your homeland.,"Dec 17, 2023",0.11541456,0.691776633,0.192808747
"Britain who created israel in 1947,  should give some of its great britain to israel. Sure the british & israeli will live happily side by side","Dec 17, 2023",0.048284743,0.459041029,0.492674202
"Just bacot wasweswos
Can be shut up or not

Your mouth smells of silicon","Dec 17, 2023",0.772480488,0.215309501,0.012209985
"River to the sea, sounds like a catch phase from a TV game ahow","Dec 17, 2023",0.280106097,0.651679099,0.068214886
"Yes, naturally they don't care about Palestine, they are more important to the world, than the humanity in Palestine, it's only natural, right looking for the world of bongs, crazy lu ndro","Dec 17, 2023",0.509958923,0.396821946,0.093219101
Why they will take them in refugees when they have their own land and they want to stay in it.,"Dec 17, 2023",0.289953858,0.672692418,0.037353683
“they cared they would take in refugees. “ isn’t that what hitler said once upon a time to the Jews when EVERYONE in this world didn’t want to take them … nazis,"Dec 17, 2023",0.679144263,0.298054785,0.022800926
Jordan has more Palestinians than Palestine so what are you talking about ?,"Dec 17, 2023",0.483949572,0.500687718,0.015362753
"You don't really understand how countries work do you? 

Just because they are similar religions. Do European countires all jump into wars as one? 

Learn about politics.","Dec 17, 2023",0.812255442,0.176743299,0.011001207
